{
  "schema_version": "0.1.0",
  "catalog_kind": "search_terms",
  "catalog_status": "planning_proposal",
  "records": [
    {
      "language": "en",
      "text": "access control issue",
      "lookup_form": "access control issue",
      "usages": [
        {
          "role": "unreviewed_issue_search_phrase",
          "record_ref": "IAM-010",
          "source_field": "aliases_en"
        }
      ],
      "review_status": "unreviewed"
    },
    {
      "language": "en",
      "text": "account access issue",
      "lookup_form": "account access issue",
      "usages": [
        {
          "role": "unreviewed_issue_search_phrase",
          "record_ref": "IAM-001",
          "source_field": "aliases_en"
        }
      ],
      "review_status": "unreviewed"
    },
    {
      "language": "en",
      "text": "Account locked out",
      "lookup_form": "account locked out",
      "usages": [
        {
          "role": "issue_label",
          "record_ref": "IAM-003",
          "source_field": "title_en"
        }
      ],
      "review_status": "unreviewed"
    },
    {
      "language": "en",
      "text": "account lockout policy",
      "lookup_form": "account lockout policy",
      "usages": [
        {
          "role": "possible_cause_phrase",
          "record_ref": "IAM-003",
          "source_field": "possible_causes"
        }
      ],
      "review_status": "unreviewed"
    },
    {
      "language": "en",
      "text": "account recovery issue",
      "lookup_form": "account recovery issue",
      "usages": [
        {
          "role": "unreviewed_issue_search_phrase",
          "record_ref": "IAM-004",
          "source_field": "aliases_en"
        }
      ],
      "review_status": "unreviewed"
    },
    {
      "language": "en",
      "text": "account status",
      "lookup_form": "account status",
      "usages": [
        {
          "role": "possible_cause_phrase",
          "record_ref": "IAM-002",
          "source_field": "possible_causes"
        }
      ],
      "review_status": "unreviewed"
    },
    {
      "language": "en",
      "text": "add-in conflicts",
      "lookup_form": "add-in conflicts",
      "usages": [
        {
          "role": "possible_cause_phrase",
          "record_ref": "EXO-003",
          "source_field": "possible_causes"
        }
      ],
      "review_status": "unreviewed"
    },
    {
      "language": "en",
      "text": "Application installation or deployment failure",
      "lookup_form": "application installation or deployment failure",
      "usages": [
        {
          "role": "issue_label",
          "record_ref": "WIN-006",
          "source_field": "title_en"
        }
      ],
      "review_status": "unreviewed"
    },
    {
      "language": "en",
      "text": "authentication or account configuration",
      "lookup_form": "authentication or account configuration",
      "usages": [
        {
          "role": "possible_cause_phrase",
          "record_ref": "IAM-001",
          "source_field": "possible_causes"
        }
      ],
      "review_status": "unreviewed"
    },
    {
      "language": "en",
      "text": "Authenticator setup issue",
      "lookup_form": "authenticator setup issue",
      "usages": [
        {
          "role": "unreviewed_issue_search_phrase",
          "record_ref": "IAM-006",
          "source_field": "aliases_en"
        }
      ],
      "review_status": "unreviewed"
    },
    {
      "language": "en",
      "text": "BitLocker recovery",
      "lookup_form": "bitlocker recovery",
      "usages": [
        {
          "role": "procedure_label",
          "record_ref": "SOP-009",
          "source_field": "title_en"
        }
      ],
      "review_status": "unreviewed"
    },
    {
      "language": "en",
      "text": "BitLocker recovery needed",
      "lookup_form": "bitlocker recovery needed",
      "usages": [
        {
          "role": "unreviewed_issue_search_phrase",
          "record_ref": "WIN-007",
          "source_field": "aliases_en"
        }
      ],
      "review_status": "unreviewed"
    },
    {
      "language": "en",
      "text": "BitLocker recovery prompt prevents normal access",
      "lookup_form": "bitlocker recovery prompt prevents normal access",
      "usages": [
        {
          "role": "issue_label",
          "record_ref": "WIN-007",
          "source_field": "title_en"
        }
      ],
      "review_status": "unreviewed"
    },
    {
      "language": "en",
      "text": "blue screen error",
      "lookup_form": "blue screen error",
      "usages": [
        {
          "role": "unreviewed_issue_search_phrase",
          "record_ref": "WIN-001",
          "source_field": "aliases_en"
        }
      ],
      "review_status": "unreviewed"
    },
    {
      "language": "en",
      "text": "Blue Screen of Death / system crash",
      "lookup_form": "blue screen of death / system crash",
      "usages": [
        {
          "role": "issue_label",
          "record_ref": "WIN-001",
          "source_field": "title_en"
        }
      ],
      "review_status": "unreviewed"
    },
    {
      "language": "en",
      "text": "boot failure",
      "lookup_form": "boot failure",
      "usages": [
        {
          "role": "unreviewed_issue_search_phrase",
          "record_ref": "WIN-002",
          "source_field": "aliases_en"
        }
      ],
      "review_status": "unreviewed"
    },
    {
      "language": "en",
      "text": "browser cache issue",
      "lookup_form": "browser cache issue",
      "usages": [
        {
          "role": "unreviewed_issue_search_phrase",
          "record_ref": "WEB-004",
          "source_field": "aliases_en"
        }
      ],
      "review_status": "unreviewed"
    },
    {
      "language": "en",
      "text": "browser crashes",
      "lookup_form": "browser crashes",
      "usages": [
        {
          "role": "unreviewed_issue_search_phrase",
          "record_ref": "WEB-001",
          "source_field": "aliases_en"
        }
      ],
      "review_status": "unreviewed"
    },
    {
      "language": "en",
      "text": "Browser crashes or unexpectedly closes",
      "lookup_form": "browser crashes or unexpectedly closes",
      "usages": [
        {
          "role": "issue_label",
          "record_ref": "WEB-001",
          "source_field": "title_en"
        }
      ],
      "review_status": "unreviewed"
    },
    {
      "language": "en",
      "text": "browser performance issue",
      "lookup_form": "browser performance issue",
      "usages": [
        {
          "role": "unreviewed_issue_search_phrase",
          "record_ref": "WEB-002",
          "source_field": "aliases_en"
        }
      ],
      "review_status": "unreviewed"
    },
    {
      "language": "en",
      "text": "browser profile issue",
      "lookup_form": "browser profile issue",
      "usages": [
        {
          "role": "possible_cause_phrase",
          "record_ref": "WEB-003",
          "source_field": "possible_causes"
        }
      ],
      "review_status": "unreviewed"
    },
    {
      "language": "en",
      "text": "Browser profile/account synchronization failure",
      "lookup_form": "browser profile/account synchronization failure",
      "usages": [
        {
          "role": "issue_label",
          "record_ref": "WEB-003",
          "source_field": "title_en"
        }
      ],
      "review_status": "unreviewed"
    },
    {
      "language": "en",
      "text": "Browser slow or unresponsive",
      "lookup_form": "browser slow or unresponsive",
      "usages": [
        {
          "role": "issue_label",
          "record_ref": "WEB-002",
          "source_field": "title_en"
        }
      ],
      "review_status": "unreviewed"
    },
    {
      "language": "en",
      "text": "browser sync failure",
      "lookup_form": "browser sync failure",
      "usages": [
        {
          "role": "unreviewed_issue_search_phrase",
          "record_ref": "WEB-003",
          "source_field": "aliases_en"
        }
      ],
      "review_status": "unreviewed"
    },
    {
      "language": "en",
      "text": "BSOD",
      "lookup_form": "bsod",
      "usages": [
        {
          "role": "unreviewed_issue_search_phrase",
          "record_ref": "WIN-001",
          "source_field": "aliases_en"
        }
      ],
      "review_status": "unreviewed"
    },
    {
      "language": "en",
      "text": "cache-related issues",
      "lookup_form": "cache-related issues",
      "usages": [
        {
          "role": "possible_cause_phrase",
          "record_ref": "WEB-002",
          "source_field": "possible_causes"
        },
        {
          "role": "possible_cause_phrase",
          "record_ref": "WEB-004",
          "source_field": "possible_causes"
        }
      ],
      "review_status": "unreviewed",
      "collision_review": true
    },
    {
      "language": "en",
      "text": "cached credentials",
      "lookup_form": "cached credentials",
      "usages": [
        {
          "role": "possible_cause_phrase",
          "record_ref": "EXO-001",
          "source_field": "possible_causes"
        }
      ],
      "review_status": "unreviewed"
    },
    {
      "language": "en",
      "text": "calendar sync issue",
      "lookup_form": "calendar sync issue",
      "usages": [
        {
          "role": "unreviewed_issue_search_phrase",
          "record_ref": "EXO-009",
          "source_field": "aliases_en"
        }
      ],
      "review_status": "unreviewed"
    },
    {
      "language": "en",
      "text": "Calendar synchronization problem",
      "lookup_form": "calendar synchronization problem",
      "usages": [
        {
          "role": "issue_label",
          "record_ref": "EXO-009",
          "source_field": "title_en"
        }
      ],
      "review_status": "unreviewed"
    },
    {
      "language": "en",
      "text": "Chrome sync issues",
      "lookup_form": "chrome sync issues",
      "usages": [